text,awareness,conscientiousness,stress,neuroticism,risk_tolerance
"I always verify the sender of emails and update my systems regularly.",0.80,0.85,0.20,0.30,0.10
"I sometimes overlook security protocols when I’m in a hurry.",0.60,0.50,0.40,0.50,0.70
"I am very cautious and always follow the recommended guidelines.",0.90,0.90,0.10,0.20,0.20
"I feel overwhelmed by the information and tend to ignore warnings.",0.55,0.40,0.80,0.75,0.65
"I take risks to get my job done faster, even if it means bypassing some steps.",0.65,0.55,0.50,0.60,0.85